,id_user,timestamp,source,message,categories
985,4560,2024-11-20,livechat,Well how do I do double or nothing with my winning,undefined
986,2788,2024-11-20,livechat,I beleive thats everything youve been more then helpfful actually is there any way you can change the money on ny account to USD,money_issue account_issue
987,8318,2024-11-20,livechat,How do I deposit? I bought Bitcoin and sent them to the Bitcoin address it says to add funds from and I haven't received it,money_issue
988,3499,2024-11-20,livechat,can i get some free spins?,spin_issue
989,9060,2024-11-20,livechat,When did they expire? I just barely received the email to confirm?,account_issue
990,8829,2024-11-20,livechat,I need to review the withdrawal for several days.,undefined
991,1038,2024-11-20,livechat,I just need a copy of my chat with jen sent to my email. It was Supposed to have been sent already,account_issue
992,8819,2024-11-20,livechat,Hi it says wagering is complete,undefined
993,8071,2024-11-20,livechat,I didn't even get to tap,undefined
994,8006,2024-11-20,livechat,This is the second time now,undefined
995,7779,2024-11-20,livechat,"I took all of the steps I was told to take regarding why my bonus games won’t play. I have activated them, signed in & out of my account, cleared my cashe in my browser, switched from WiFi to data and they still don’t play",money_issue spin_issue game_issue account_issue
996,8937,2024-11-20,livechat,Agent please,undefined
997,8237,2024-11-20,livechat,Will do.. Good day,undefined
998,8994,2024-11-20,livechat,Yes it let me activate them but it's acting as if I don't have bonus spins.. I tried the tap the pot and I'm having the same issue,spin_issue money_issue
999,9052,2024-11-20,livechat,I wait for that long time why are you no problem with me? You’re no problem from you. No deposit for me. I put money and a long time and Ana my account.,money_issue account_issue
1000,1843,2024-11-20,livechat,No it showed me the same thing when I tried yesterday so it must have been someone else,undefined
1001,7800,2024-11-20,livechat,This is all it says,undefined
1002,8212,2024-11-20,livechat,There isn't anywhere to choose that ingame,undefined
1003,8036,2024-11-20,livechat,Is it because i didnt click on the promotion when made deposited?,money_issue
1004,9059,2024-11-20,livechat,"No, I deposit three times yes but I play only two times",money_issue game_issue
1005,8621,2024-11-20,livechat,What time? I said the time before now it’s ran out but it’s not in??,undefined
1006,8539,2024-11-20,livechat,I have done more than that,undefined
1007,8246,2024-11-20,livechat,"Again, I won free spins, won NOTHING, then again like two minutes later, won NOTHING",spin_issue
1008,7938,2024-11-20,livechat,Can i not get the 100$ back atleast,undefined
1009,7850,2024-11-20,livechat,Yes no problem,undefined
1010,9152,2024-11-20,livechat,i I know if spins are played or not,spin_issue game_issue
1011,8729,2024-11-20,livechat,im not clicking on it,undefined
1012,9048,2024-11-20,livechat,It didn't let me play started talking about I needed to upload money,money_issue game_issue
1013,8053,2024-11-20,livechat,I’m wanting a different set of free spins please,spin_issue
1014,8963,2024-11-20,livechat,i should have a lot of Wednesday spins.  I’m not understanding this,spin_issue
1015,7891,2024-11-20,livechat,at one time?,money_issue
1016,7927,2024-11-20,livechat,Ok. That's not what happened. It crashed and reset,money_issue
1017,7835,2024-11-20,livechat,I lost my free spins,spin_issue
1018,8698,2024-11-21,livechat,Search this girl,undefined
1019,1605,2024-11-21,livechat,Trying to cashout  but having troule,money_issue
1020,2014,2024-11-21,telegram,The winnings from the free spins. Can I convince on in playing on the same game?,spin_issue game_issue
1021,8082,2024-11-21,livechat,Hesabımı Google ile oluşturdugum için isim soy isimde ufak bı yanlışlık var,undefined
1022,184,2024-11-21,telegram,Is the website down today?,undefined
1023,2016,2024-11-21,telegram,Yes I won bet coin on one game and then on the other free spins I realized I could use USD instead. So I had won some in btcn and some in cash. The winnings in cash I played or wagered on the games u mentioned. The Bitcoin was still showing as an available balance to withdraw,money_issue spin_issue game_issue
1024,8743,2024-11-21,livechat,can I leave this chat to check the name,game_issue
1025,161,2024-11-21,telegram,Playing blackjack just now screen blinked said “something went wrong “ zeros out my balance,game_issue
1026,8267,2024-11-21,livechat,Yes I won 100 and something with my spins how do I get that to where I can withdrawl,spin_issue
1027,8675,2024-11-21,livechat,Omg! Yes thank you!!!! Jen,undefined
1028,184,2024-11-21,telegram,Yesterday my account was disabled and then fixed but the site kept crashing,money_issue account_issue
1029,4506,2024-11-21,livechat,I'll check rn,undefined
1030,5297,2024-11-21,livechat,Ok nice to no,undefined
1031,7960,2024-11-21,livechat,Hi I requested a cash out and received a link to verify my btc address.  Every time I click the link the page times out. Now when I click it it says contact support.  Did you receive my confirmation?,money_issue
1032,204,2024-11-21,telegram,"Hi. I'm missing a €20 deposit from November 12, 2024 at 11:30 p.m. See screenshots. My bank says the €20 has been posted. Site says the deposit is canceled. 7 banking days are over .. and these 20 euros never showed up again. Attached is the bank statement from 11/12/24 - today 11/21/24. Kind regards I have been a customer for a long time and have spent large amounts with you. 20 euros are peanuts for you. I ask for quick help. Thanks Kind regards",money_issue account_issue
1033,8942,2024-11-21,livechat,Can I deactivate my own account and just recreate a new one?,account_issue
1034,2093,2024-11-21,livechat,but I swear it wasn't intentional,undefined
1035,8259,2024-11-21,livechat,It won't let me play my tenfree spin it said pick game then it send me to the game but no free play and I have them but can't play them,spin_issue game_issue
1036,8117,2024-11-21,livechat,Hi I xhexmed it,undefined
1037,2027,2024-11-21,telegram,I bought 50 through MoonPay but I didn’t receive  those 2 new bonuses ?,money_issue
1038,8818,2024-11-21,livechat,I am very disappointed that I paid $100 and can not use it to playy,game_issue
1039,7967,2024-11-21,livechat,I've done this it isn't working,undefined
1040,7162,2024-11-21,livechat,Hey I'm having trouble with my promotion It won't give me to play,game_issue
1041,7935,2024-11-21,livechat,I appreciate your time,undefined
1042,6998,2024-11-21,livechat,But I understand,undefined
1043,8172,2024-11-21,livechat,Please do.,undefined
1044,8652,2024-11-21,livechat,I want to ask about the 100$  conversion,undefined
1045,7767,2024-11-21,livechat,Paul I need free spins please.,spin_issue
1046,8593,2024-11-21,livechat,can You explain to me what the bonus mania is exactly I’m not following the idea of it ? What did I win exactly,money_issue
1047,2033,2024-11-21,telegram,I win some J$ from daily bônus but i cant see them in my account,money_issue account_issue
1048,9159,2024-11-21,livechat,yeah they deliberately word it “differently” to scam us then ? I mean that’s messed up,undefined
1049,2039,2024-11-21,telegram,I re received 20 free spins on catdiana but once I received 20 free spins on get into game it is not applying any free spins,spin_issue game_issue
1050,9030,2024-11-21,livechat,Okay it did say valid code,undefined
1051,8595,2024-11-21,livechat,Like u have encountered a technical error please contact your support team not exactly that but close,account_issue
1052,4157,2024-11-21,livechat,You betcha Harvey.,undefined
1053,1224,2024-11-21,livechat,So is it agai st the rules to cashout to another,money_issue
1054,814,2024-11-21,telegram,Why is it pending never did this so long before,undefined
1055,9118,2024-11-21,livechat,Hello welcome from Somalia 🇸🇴,undefined
1056,8025,2024-11-21,livechat,"no, you have been more than helpful. Thank you.",undefined
1057,1043,2024-11-21,telegram,Any cashback or the pig didn't break,money_issue
1058,249,2024-11-21,telegram,My username is ***** and I just played lucky cash spins by the one spin for wind provider and I got the three blue stars bonus and went through the bonus till I think the last spin or the fourth out of the fifth spin and it glitched and just kept making the money sound when you win and then I refresh the page thinking I could just go back into the bonus and I went back into the game and it was as if the bonus never happened and I was not credited my bonus money,money_issue spin_issue game_issue
1059,8685,2024-11-21,livechat,I deposited €112.08.,money_issue
1060,8241,2024-11-21,livechat,I didn’t intentionally change the currency Sean.,undefined
1061,2199,2024-11-21,livechat,1 of 10 times it works,undefined
1062,2256,2024-11-21,livechat,1/10 times it works,undefined
1063,8528,2024-11-21,livechat,that must’ve been frustrating for you to explain. I’m sorry.,undefined
1064,9094,2024-11-21,livechat,i want to cash out in rands,money_issue
1065,1500,2024-11-21,livechat,No thank you tho,undefined
1066,8502,2024-11-21,livechat,I recently made a $50 deposit and I was just checking on where it’s at,money_issue
1067,8363,2024-11-21,livechat,I’ve never had such a hard problem or a hard time getting my money Or my free spins from any company,spin_issue money_issue
1068,6462,2024-11-21,livechat,Who is my wallet provider I thought it was all through bit Stars,money_issue
1069,8248,2024-11-21,livechat,"If i deposit 50€ and get soke bonus spins. If i make profit before playing bonus, can i withdraw normaly?",money_issue spin_issue game_issue
1070,1774,2024-11-21,livechat,Yes so this whole promotion going on about the mega spins and all that it says you'll get 3 separate rewards and the more you deposit yhe more you get I DEPOSITED 300 DOLLARSSSSSS,spin_issue money_issue
1071,9581,2024-11-21,livechat,I deposited $80 yesterday,money_issue
1072,8718,2024-11-21,livechat,can i gave free spins in the meantime,spin_issue game_issue
1073,1756,2024-11-21,livechat,I've check all my settings and it shoes so can u check for me please I did the deposit of 60 and no mega spins,spin_issue money_issue
1074,9504,2024-11-21,livechat,I was just wondering if you can explain to me When I look on my rewards page it says the piggy bonus requires a $50 minimum deposit but on my homepage it says it requires $70,money_issue
1075,8420,2024-11-21,livechat,Bonus rewards,money_issue
1076,8424,2024-11-22,livechat,if you look on my account,account_issue
1077,7910,2024-11-22,livechat,I'm going to deposit right now,money_issue
1078,8190,2024-11-22,livechat,You can Activate Free Spins,spin_issue
1079,336,2024-11-22,livechat,"Account is locked,can't play any games",game_issue account_issue
1080,9004,2024-11-22,livechat,ur promo is down for maintenance is it not? that’s what it says on my screen,undefined
1081,9227,2024-11-22,livechat,Hello I accidentally sent Litecoin to my Bitcoin wallet,money_issue
1082,9396,2024-11-22,livechat,will i get both bonuses with one deposit,money_issue
1083,2045,2024-11-22,livechat,Friday loyalty bonus rewards,money_issue
1084,2374,2024-11-22,livechat,But it does not show it anywhere,undefined
1085,278,2024-11-22,telegram,I received my Friday loyalty bonus email. And 10 free spins. I'm supposed to log in and activate my loyalty bonus - but it is not there to be activated.,spin_issue money_issue account_issue
1086,278,2024-11-22,telegram,Oh shit. Okay 😳🫣,undefined
1087,7357,2024-11-22,livechat,"No, it doesn’t say that it says deposit $50 .. Not make a $50 deposit",money_issue
1088,8610,2024-11-22,livechat,Oh no what? Really!?,undefined
1089,5612,2024-11-22,livechat,"Sorry, the problem is not fix it",undefined
1090,9232,2024-11-22,livechat,Sup dude I had activated my bonus then It was gone:?,money_issue
1091,9519,2024-11-22,livechat,this is very unusual. my daughter had USA ID and was allowed in verification,undefined
1092,9534,2024-11-22,livechat,Many more games then igaming,game_issue
1093,588,2024-11-22,livechat,Could I be transferred to him,undefined
1094,1802,2024-11-22,livechat,How long does it take for them to respond usually?,undefined
1095,1361,2024-11-22,livechat,I sent it from my coinbase and was supposed to get usdt on tron,undefined
1096,1597,2024-11-22,livechat,How we I won it y'all never did this,undefined
1097,8658,2024-11-22,livechat,im not typing shit to you again. You aren’t even real,undefined
1098,1097,2024-11-22,livechat,My account is locked,account_issue
1099,8350,2024-11-22,livechat,They're not blurry it's the lighting lol,undefined
1100,8372,2024-11-22,livechat,im missing s[ins,spin_issue
1101,8879,2024-11-22,livechat,i dont want it to be deposited into my bank account,money_issue account_issue
1102,8785,2024-11-22,livechat,if I win again what would be deducted?,undefined
1103,9525,2024-11-22,livechat,2 questions…,undefined
1104,354,2024-11-22,telegram,I couldn’t access my free spins,spin_issue account_issue
1105,8794,2024-11-22,livechat,I have made a deposit today,money_issue
1106,1772,2024-11-22,telegram,Hey I’m having trouble cashing out can you check it for me please,money_issue
1107,8344,2024-11-22,livechat,i requested a recent cash out for $600 can you cancel that please i sent the wrong adress,money_issue
1108,68,2024-11-22,telegram,For real lol they are pretty smart tho or at least know how to work telegram,undefined
1109,8345,2024-11-22,livechat,So no there isn't any actual money....lol,money_issue
1110,8380,2024-11-22,livechat,Because i.was locked out  of email.n.missed so many rewards,account_issue
1111,9617,2024-11-22,livechat,or does it gradually increase over time after no one wins it,money_issue
1112,1230,2024-11-22,livechat,I would like to use my valid code if that works,undefined
1113,2637,2024-11-22,livechat,Just seeing what game I can use it on,game_issue
1114,269,2024-11-22,telegram,Can you please check why my other account got canceled? I don’t live nor am I in another country. I had a VPN running on my laptop. Hell the furthest away from the USA that I’ve ever been is Toronto. I don’t want to lose my points/status or whatever :(,account_issue
1115,269,2024-11-22,telegram,I never type it to sign in bc it’s saved ;) lol so I forget which email if it’s business or personal email I used,spin_issue account_issue
1116,9096,2024-11-22,livechat,I already know all that but that's not what I'm talking aboutif,undefined
1117,9517,2024-11-22,livechat,Wondering if u can honor the bonus spins,spin_issue money_issue
1118,269,2024-11-22,telegram,Why can’t you transfer my status? That should be possible to my new account?,account_issue
1119,498,2024-11-22,livechat,I would like my loyalty bonus issued because not only couldn’t cashout funds I lost my loyalty bonus,money_issue
1120,253,2024-11-22,telegram,Hi this morning I made two deposits when the Bonuz Mania spins promotion was not working but I just received 1 set of free spins and not the other one for the second deposit,spin_issue money_issue
1121,9655,2024-11-22,livechat,I deposited 50 dollars buy need to have it transfered from bitcoin to usd,money_issue
1122,9324,2024-11-22,livechat,I going to the game. And it starts to go and then it just kicks me right out,game_issue
1123,2190,2024-11-22,livechat,Take care have a nice day,undefined
1124,8434,2024-11-22,livechat,and th epiggy prizes are 40x olaythrough right?,undefined
1125,8612,2024-11-22,livechat,All the times before I did but I didn't receive my spins just now,spin_issue
1126,9262,2024-11-22,livechat,wow thats my unaware ass lol,undefined
1127,261,2024-11-22,telegram,I am playing on bitcoincasino.io at the moment with the same deposits I have done here recently so just checking if you can offer something i can play with here also before I can deposit again?,money_issue game_issue
1128,261,2024-11-22,telegram,If I don't qualify I understand,undefined
1129,9195,2024-11-22,livechat,I think so,undefined
1130,9797,2024-11-22,livechat,okay I apologize for taking your time. thank you for looking into for me I do appreciate it,undefined
1131,5974,2024-11-23,livechat,I'm not talking about the ones I got this morning talking bout the ones I just got few mins ago,money_issue
1132,9818,2024-11-23,livechat,I deposited $50 then $30,money_issue
1133,9916,2024-11-23,livechat,Why can’t I activate my free spend,spin_issue
1134,8728,2024-11-23,livechat,It won't even let me do that,undefined
1135,8547,2024-11-23,livechat,I sent the below minimum with the price of Bitcoin going up I failed to realize that I sent below the minimum needed,money_issue
1136,399,2024-11-23,telegram,Ibdont understand what the point of these 3 spins i just spun was for i know I got it for depositing like 50 but it's forJ bucks  that aren't even real money what is the pooint,spin_issue money_issue
1137,1624,2024-11-23,livechat,Yes and piggy,undefined
1138,8737,2024-11-23,livechat,also with the deposit I just made after deducfing the Bitcoin fee is under 50  so does that mean I am not eligable for piggyz cash or 3x bonus mania spins,spin_issue money_issue
1139,8582,2024-11-23,livechat,I don’t have them in my wallet any more e what is this I have send a lot of crypto and only this one didn’t go through,money_issue
1140,8201,2024-11-23,livechat,Or how does that work?,undefined
1141,1704,2024-11-23,livechat,Comment récupéré le code 2fa,undefined
1142,9339,2024-11-23,livechat,I’m having an issue with my Wednesday free 20 spins please advice,spin_issue
1143,9394,2024-11-23,livechat,And it is still showing pending on the block chain,undefined
1144,8825,2024-11-23,livechat,no I received my funds but the computer only gave me one round of piggy spins,money_issue spin_issue game_issue
1145,4654,2024-11-23,livechat,I have feeling my old room mate hacked me again. I dunno,spin_issue
1146,9703,2024-11-23,livechat,"select currency it's there, then i go to cashout and no balance",money_issue
1147,9188,2024-11-23,livechat,My account is disabled,account_issue
1148,2938,2024-11-23,livechat,If you understand that correctly and the answer is no well is there can I deposit a little more right now to make up to like the 50,money_issue
1149,2055,2024-11-23,livechat,I have a bonus of 200 free play from Wednesday that I never got to finish and everytime I try it goes back to  to charging me I don't get to finish playing it or get my winnings?,money_issue spin_issue game_issue
1150,9739,2024-11-23,livechat,This is ridiculous it's been over 4 hours now and nothing,undefined
1151,8887,2024-11-23,livechat,I deposited $50 more than a couple of times and I'm wondering why I haven't received the new promotion with the bonanza s the bonus and stuff,money_issue
1152,9306,2024-11-23,livechat,"No, I did hop into an elevator briefly though. I may have lost connection when I hit activate.",undefined
1153,9970,2024-11-23,livechat,"Yeah, tried all three. They don't start the spins.",spin_issue
1154,9111,2024-11-23,livechat,Much appreciated,undefined
1155,8649,2024-11-23,livechat,The piggy and spins bonus,spin_issue money_issue
1156,15,2024-11-23,telegram,"So my question is this. You know how u guys have the new bonuses a d what not.  Like the deposit of 50 or more gets you bonus spins I believe, and then there is the piggy bank one.  My question is for the latter",spin_issue money_issue
1157,6693,2024-11-23,livechat,It was processing while I won that,undefined
1158,8693,2024-11-23,livechat,Cause I seen to always have a problem an if it's going to be like that then why not put it on a note or let the customer know u know what I mean,money_issue
1159,9793,2024-11-23,livechat,Spin mania spins weren’t added to my first 100 dollar deposit tonight,spin_issue money_issue
1160,9451,2024-11-23,livechat,Where’s my deposit I made?,money_issue
1161,1856,2024-11-23,livechat,Ok next moon pay the only way to get crypto or can I use skrill,game_issue
1162,253,2024-11-23,telegram,By mistake I think I cancel my bonus of bonuz mania of 48$ can you reactivate it ?,money_issue
1163,10192,2024-11-23,livechat,Ah ok. I see. Thank you for your help.,undefined
1164,8791,2024-11-23,livechat,"Ok thanks for your assistance with this matter,",undefined
1165,9440,2024-11-23,livechat,I pulled up your exchange feature,undefined
1166,10014,2024-11-23,livechat,I already activated the 10 free games.,spin_issue game_issue
1167,1202,2024-11-23,livechat,Before my account was active but now unactive,account_issue
1168,3240,2024-11-23,livechat,I'm taking the screenshot of it just in case,money_issue
1169,1485,2024-11-23,livechat,Dont send me this fucking copy paste,undefined
1170,9204,2024-11-23,livechat,I didn’t take a screenshot.,undefined
1171,9490,2024-11-23,livechat,what is the amount of Ethereum?,account_issue
1172,10089,2024-11-23,livechat,Masud Moradi,undefined
1173,8804,2024-11-23,livechat,"Good afternoon, I have a problem with a slot. I bought a bonus of 120 usd, it stayed loading and never started. I closed the game and opened it again and nothing happened, and I didn't get my money back either......what do I do?",money_issue game_issue
1174,9179,2024-11-23,livechat,no thank u,undefined
1175,8977,2024-11-23,livechat,I’m still waiting for my refund that I was supposed to get,money_issue
1176,425,2024-11-23,livechat,Nvm i understand  that,undefined
1177,9323,2024-11-24,livechat,So youre saying i didnt win anything?,undefined
1178,2511,2024-11-24,livechat,I understand everything about the terms of bonuses I'm not here for any of that but I want it unlinked if it was I can't see anything about it rn,money_issue
1179,8006,2024-11-24,livechat,Yay! Thanks Olivia,undefined
1180,9106,2024-11-24,livechat,And so can you,undefined
1181,8896,2024-11-24,livechat,so I’ll take my chances with one of your colleagues,money_issue
1182,1154,2024-11-24,livechat,it don't mater,undefined
1183,1901,2024-11-24,livechat,they discarded it I don't know what that means but is there anyway to fix this,undefined
1184,2060,2024-11-24,telegram,So can I playbwith it or no ? What good is it in the jpm balance if i can't play it. Just curious. Haven't spent alot of time on your site,game_issue
1185,9348,2024-11-24,livechat,I sent it to the code. I got from the deposit on here.,money_issue
1186,9151,2024-11-24,livechat,I can send a screen shoy if you want,undefined
1187,9986,2024-11-24,livechat,I would like to rate you 10 stars and will definatly fill out any survay forbyou..,undefined
1188,1792,2024-11-24,livechat,Hey Milo I did two deposits totaling 50$ and didn’t get my bonus spins,spin_issue money_issue
1189,9173,2024-11-24,livechat,I come to your website and have to register nothing else,undefined
1190,621,2024-11-24,livechat,Yes I been trying to resolve my deposit that didnt show but I kept getting kicked out of the chat about 2 times already,money_issue
1191,10027,2024-11-24,livechat,Hi do I have any birthday gifts,undefined
1192,3704,2024-11-24,livechat,Can I withdraw 200 off of the piggy game if I've won 330?,game_issue
1193,9523,2024-11-24,livechat,I hv deposited twice here and hvnt gotten my bitcoin,money_issue
1194,894,2024-11-24,livechat,how many confirmed do I have in my ltc deposit,money_issue
1195,755,2024-11-24,livechat,OK check my deposit,money_issue
1196,8982,2024-11-24,livechat,Why was my cashout canceled,money_issue
1197,9930,2024-11-24,livechat,accounts disclosure,account_issue
1198,9427,2024-11-24,livechat,Please help me out,undefined
1199,10115,2024-11-24,livechat,When it started,undefined
1200,7620,2024-11-24,livechat,What's the minimum amount because I only deposited 7.98$ after fees,spin_issue money_issue account_issue
1201,8875,2024-11-24,livechat,Yes live agent,undefined
1202,9785,2024-11-24,livechat,i give you my word to reopen it,undefined
1203,10287,2024-11-24,livechat,It was a bank transfer,undefined
1204,10025,2024-11-24,livechat,They said it there,undefined
1205,8574,2024-11-24,livechat,would you please be so kind as to check whether a document is still missing? 😄,undefined
1206,1794,2024-11-24,livechat,I see thank you,undefined
1207,292,2024-11-24,livechat,I never received the free spins,spin_issue
1208,9853,2024-11-24,livechat,i cant upload the back of the card casue there is no back on the virtual cards,money_issue
1209,9801,2024-11-24,livechat,Please keep this chat open,undefined
1210,7521,2024-11-24,livechat,What a beautiful day what a disappointment I know I won it's paid me just to match 3 even on the middle,undefined
1211,10120,2024-11-24,livechat,It is in the same box that bonus mania was in but no it wasn't part of that,money_issue
1212,9128,2024-11-24,livechat,That is not cool,undefined
1213,8824,2024-11-24,livechat,What the heck,undefined
1214,8883,2024-11-24,livechat,i need also an email confirmation with your blockchain adress the value of btc and my adress,money_issue account_issue
1215,8454,2024-11-24,livechat,i need an screenshot with the blockchain adressesn,undefined
1216,10011,2024-11-24,livechat,It has 5 confirmation at this point,undefined
1217,9114,2024-11-24,livechat,by the time i came back after my function or was down by hundreds and i thought it was super strange,game_issue
1218,5956,2024-11-24,livechat,If you got the time sure,undefined
1219,10456,2024-11-24,livechat,"just because I use the spins on a different account, but it wasn’t me someone use my phone to make their account",spin_issue account_issue
1220,9582,2024-11-24,livechat,so how can you take that money that is crazy . This is so beyond messed up,money_issue
1221,8920,2024-11-24,livechat,I didn't receive any spins?,spin_issue
1222,8961,2024-11-24,livechat,both times said code was active put 100 and 50,undefined
1223,9580,2024-11-24,livechat,I’m trying use my free spins but when I go into the game they aren’t there,spin_issue game_issue
1224,10271,2024-11-25,livechat,I want to speak with a superhero,undefined
