,id_user,timestamp,source,message,categories
2213,14919,2024-12-14,livechat,\n\n\n\nWhy was my account suspended,account_issue
2214,10829,2024-12-14,livechat,I don't get it,undefined
2215,14119,2024-12-14,livechat,Chatting on laptop,undefined
2216,14626,2024-12-14,livechat,I'm done here,undefined
2217,13828,2024-12-14,livechat,Ok have a good night thanks for your time,undefined
2218,13698,2024-12-14,livechat,This is what it showed me before I made a deposit then it disappeared,money_issue
2219,14356,2024-12-14,livechat,first deposit free spins,spin_issue money_issue
2220,3115,2024-12-14,telegram,I just took picture with another device,undefined
2221,13621,2024-12-14,livechat,i uploaded them,undefined
2222,13628,2024-12-14,livechat,Can you Connect me with him,undefined
2223,13795,2024-12-14,livechat,So I'll have her log in how do I stay in contact with you,account_issue
2224,3099,2024-12-14,telegram,Mean you are saying without me getting a unnecessary service contract on my name,game_issue
2225,3099,2024-12-14,telegram,Rejected,undefined
2226,14245,2024-12-14,livechat,yes I did that and litecoin was not in there,money_issue
2227,10791,2024-12-14,livechat,Just like I wasn't paying attention when you put the money on back in my account almost downtown I realized it was on there and I almost lost it all smooth move I like how,money_issue game_issue account_issue
2228,4687,2024-12-14,livechat,Hey scammer when you give my withdrawal,undefined
2229,14000,2024-12-14,livechat,Ok ty so ur saying the fee to send was over 3 dollars,spin_issue
2230,14439,2024-12-14,livechat,it was recently,undefined
2231,14007,2024-12-14,livechat,It says deposit any amount,money_issue account_issue
2232,12798,2024-12-14,livechat,i just recently moved to this complex and was not aware of the prior people that lived here,undefined
2233,13922,2024-12-14,livechat,but today i log in back for double check,account_issue
2234,14121,2024-12-14,livechat,can you give me back,undefined
2235,14793,2024-12-14,livechat,You guys made a new wallet,undefined
2236,13954,2024-12-14,livechat,No that’s it have a great day,undefined
2237,13690,2024-12-14,livechat,robot cannot help,undefined
2238,14390,2024-12-14,livechat,There's 2 games in the corner,game_issue
2239,14262,2024-12-14,livechat,I have 3 accounts,account_issue
2240,12087,2024-12-14,livechat,Can you help me fix it please,undefined
2241,14806,2024-12-14,livechat,I put money on my account like a week ago and it's still not on there it was right before the notice about new deposited addresses came up,money_issue game_issue account_issue
2242,14548,2024-12-14,livechat,Hi Aaron how are you ?,undefined
2243,14768,2024-12-14,livechat,research this,undefined
2244,14487,2024-12-14,livechat,I don't have that card any more. My wallet was stolen along with basically my whole life (long story you don't want to hear). So how do I proceed? I can send a picture of the replacement card I have.,undefined
2245,13751,2024-12-14,livechat,Hey I see I have been credited my last deposit just not my 30$ deposit,money_issue
2246,14046,2024-12-14,livechat,"Okay I believe I sent one, hopefully it is what yous are looking for",undefined
2247,1576,2024-12-14,livechat,I was wondering what cheaper like PLN since BTC is expensive thanks,spin_issue money_issue
2248,13741,2024-12-14,livechat,As I have pressed play - played Wild West at high bets but I have 0,money_issue game_issue
2249,14001,2024-12-15,livechat,i tried to make a withdrawal and it now says cancled but i dont recall see this back in my balance?,undefined
2250,14437,2024-12-15,livechat,I still can't get my free games to work I have activated them but it doesn't start when I start the slot,spin_issue game_issue
2251,14716,2024-12-15,livechat,Here’s the time stamp,undefined
2252,14238,2024-12-15,livechat,I made a deposit and I didn't know that there was a minimum can you please deposit my money it's only $10 would I like to have it,money_issue
2253,2489,2024-12-15,livechat,Are both of my cashout addresses confirmed?,money_issue
2254,14571,2024-12-15,livechat,Can you check on my deposit of 33.00? Bitcoin. It’s not ahowing,money_issue
2255,15127,2024-12-15,livechat,Never mind this stupid bitcoin machine I ysed,money_issue
2256,14291,2024-12-15,livechat,can u put it,undefined
2257,14207,2024-12-15,livechat,It has been way over an hour,undefined
2258,14458,2024-12-15,livechat,"Okay so tomorrow is a banking day, should receive next few days?",undefined
2259,12532,2024-12-15,livechat,Why didn't I get my piggy mania?,undefined
2260,13611,2024-12-15,livechat,made 3-4 hundred today,undefined
2261,13992,2024-12-15,livechat,I would like to speak to a live chat agent,undefined
2262,14305,2024-12-15,livechat,the address do belongs to casino you can see in your own eyes please,undefined
2263,13835,2024-12-15,livechat,IT IS legion de tranře,account_issue
2264,14742,2024-12-15,livechat,can you help me,undefined
2265,13816,2024-12-15,livechat,I should be credited,undefined
2266,738,2024-12-15,telegram,I've sent tons of info can you please have them review it,undefined
2267,13824,2024-12-15,livechat,"So, being we stayed at the same hotel, it disqualifies me?",undefined
2268,13845,2024-12-15,livechat,So basically it's useless..,undefined
2269,14800,2024-12-15,livechat,We got cut off,undefined
2270,13023,2024-12-15,livechat,Am I not a loyal customer?,game_issue
2271,7246,2024-12-15,livechat,And what is rackback money,money_issue
2272,14720,2024-12-15,livechat,it’s alright though it’s only a few bucksn,undefined
2273,828,2024-12-15,livechat, I just saw it on block chain,undefined
2274,738,2024-12-15,telegram,I can't upload the pdf files through there for my rental agreement,undefined
2275,738,2024-12-15,telegram,I have no idea,undefined
2276,13855,2024-12-15,livechat,Permanently close account,account_issue
2277,738,2024-12-15,telegram,I really hope that allows me to withdraw money to the same bank account it came out of,money_issue game_issue account_issue
2278,14634,2024-12-15,livechat,or imma call the better BUISNESS bureau,undefined
2279,13747,2024-12-15,livechat,it was $18 bet,undefined
2280,196,2024-12-15,telegram,I can’t use code DEC15,undefined
2281,37,2024-12-15,telegram,Yeah it’s not working,undefined
2282,15083,2024-12-15,livechat,so please help me update this email address,account_issue
2283,15090,2024-12-15,livechat,I have deposited over 600$ an first time im doing a withdrawal i cant do it....,money_issue
2284,14670,2024-12-15,livechat,It happens all the time. Every time,undefined
2285,14818,2024-12-15,livechat,ok do I need to go to my crypto account and send it again?,account_issue
2286,5887,2024-12-15,livechat,They never did and yes you can you have a spot to enter bonus codes in the account page for rewards and bonuses,money_issue account_issue
2287,14556,2024-12-15,livechat,Online support agent,undefined
2288,11406,2024-12-15,livechat,It's taking a long time,undefined
2289,14881,2024-12-15,livechat,beacause i forgotte,undefined
2290,14524,2024-12-15,livechat,I made 1300$ on jackpot spins but I don’t get any reward,spin_issue game_issue
2291,14266,2024-12-15,livechat,what is this,undefined
2292,15174,2024-12-15,livechat,"these 2 documents weren't mentioned last week, and I was waiting all weekend to be verified",undefined
2293,2004,2024-12-15,livechat,But if I did 30 it stayed lit up,undefined
2294,15191,2024-12-15,livechat,Can i have someone who can kindly help me have my spins please 🙏🏼,spin_issue
2295,1948,2024-12-15,livechat,It's like ended my chat,undefined
2296,1564,2024-12-15,livechat,So you didn't even know it was a problem or that it was doing that,undefined
2297,2535,2024-12-15,livechat,The Specialist or whatever,undefined
2298,14241,2024-12-15,livechat,What pdf document,undefined
2299,2162,2024-12-15,livechat,You guys are just fucking crooked you've done so much crooked shit you guys used to be cool but now fuck no,undefined
2300,14691,2024-12-15,livechat,ohh ok I misssd the email,account_issue
2301,234,2024-12-16,telegram,is there a mco,undefined
2302,14272,2024-12-16,livechat,Yeah but then I’ve got from free games 800 euro and wanted to cash out but now I got an email where you say where my last deposit was returned and the remaining funds were forfeited,money_issue spin_issue game_issue account_issue
2303,234,2024-12-16,telegram,is there a min wager per spin,spin_issue
2304,14039,2024-12-16,livechat,Hi just wondering why I can’t use the bonus buy option on Oceans catch. It’s happened 2 days in a row now,money_issue
2305,15268,2024-12-16,livechat,But maybe I just wait a little bit im sure it will go on there,money_issue
2306,14176,2024-12-16,livechat,Okay great thanks,undefined
2307,14727,2024-12-16,livechat,Can 8 have another one,money_issue
2308,2837,2024-12-16,livechat,You'd think you would've warned me about that,undefined
2309,1087,2024-12-16,livechat,Hi how is cashback allocated and how much do I currently qualify for,money_issue
2310,14048,2024-12-16,livechat,I don't want to talk to a robot I want to talk to somebody live somebody real,undefined
2311,14598,2024-12-16,livechat,Got this email today but still no funds,money_issue account_issue
2312,13962,2024-12-16,livechat,I still don't see it,undefined
2313,2298,2024-12-16,telegram,I was in the middle of my free bonus spins and it backed out of the game why can't I access my free spins again,money_issue spin_issue game_issue account_issue
2314,14894,2024-12-16,livechat,or do we train ourselves on the go,undefined
2315,1095,2024-12-16,livechat,Yes I have tried the mirroring link,undefined
2316,14990,2024-12-16,livechat,"Hi! I deposited a little while ago and forgot to check to see if I got the 50% Monday bonus. Usually it’s automatic when I deposit, but I didn’t receive it this time. Is there a way to award that?",money_issue
2317,14951,2024-12-16,livechat,It’s been confirmed in blockchain where is my deposit,money_issue
2318,14943,2024-12-16,livechat,How could I have played it at 1:37 when it didn’t clear Blockchain till 211?,game_issue
2319,12153,2024-12-16,livechat,is it right,undefined
2320,15336,2024-12-16,livechat,i was in the middle of a game and it just booted me and oh ok thanks,game_issue
2321,14034,2024-12-16,livechat,only spot is quick depsoit,money_issue
2322,6593,2024-12-16,livechat,My 1st deposit was over 50$,money_issue
2323,2493,2024-12-16,livechat,Look into it,undefined
2324,15340,2024-12-16,livechat,for no deposit there is,money_issue
2325,1210,2024-12-16,livechat,Hey I have 10 free spins in my active rewards but I can't spin them,spin_issue
2326,13953,2024-12-16,livechat,does that mean will receive at end ofonth,undefined
2327,15155,2024-12-16,livechat,Hello this is seriously wrong and I didn't activate this bonus it was already on my account. Now I lose all my own money cause of this stupid bonus thats messed up,money_issue account_issue
2328,14944,2024-12-16,livechat,Gymnastics right in front of your f****** eyes are you stupid,undefined
2329,1398,2024-12-16,livechat,"Hi Emma, I have deposited but haven't received Monday reload bonus could you pls check",money_issue game_issue
2330,14579,2024-12-16,livechat,Like you guys suggest,undefined
2331,14428,2024-12-16,livechat,"Hello, may I know why you canceled my withdrawal and took away the money that I earned with the bonus that you yourselves gave me?",money_issue game_issue
2332,14041,2024-12-16,livechat,Reopen account,account_issue
2333,14974,2024-12-16,livechat,Phone reimbursed for all the money I put in tonight cuz this is b******* and I want to be able to cash it out too which is only what a total of $30,money_issue
2334,14914,2024-12-16,livechat,With all the proof I got to not alone showed your system faulting and you're not up to code,undefined
2335,15285,2024-12-16,livechat,"And I don't believe you, if someone else has the same ip as me then someone has hacked your site",undefined
2336,8894,2024-12-16,livechat,no the cashback received from it,money_issue
2337,8435,2024-12-16,livechat,which disappeared,undefined
2338,2890,2024-12-16,livechat,Yes but then i wont have my money I put on here on here to play!!!,money_issue game_issue
2339,14797,2024-12-16,livechat,Each membership site opened using the fake e-mail duplication method will be a data burden for your site.,account_issue
2340,14708,2024-12-16,livechat,actually not for the sign up its all about the Actually there is deception,spin_issue
2341,1850,2024-12-16,livechat,And if I win it's for bonus yes ?,money_issue
2342,14170,2024-12-16,livechat,Why were my funds taken?,money_issue
2343,2044,2024-12-16,livechat,How are you,undefined
2344,1718,2024-12-16,livechat,said u could prb help me with that,undefined
2345,8075,2024-12-16,livechat,I mean I've been taken for 1900 on scam casinos . Be nice to play here,game_issue
2346,15308,2024-12-16,livechat,Because on my side it said it completed,undefined
2347,506,2024-12-16,livechat,But I've sent less and had it go on. Is there any way you can credit my account just one more time please,money_issue account_issue
2348,15083,2024-12-16,livechat,Look at my history bets,undefined
2349,15357,2024-12-17,livechat,im okay to log back in,account_issue
2350,1084,2024-12-17,livechat,hi i wanted to check on my deposit >,money_issue
2351,14288,2024-12-17,livechat,I was scammed by your slot machine,undefined
2352,15465,2024-12-17,livechat,my account is suspended,account_issue
2353,14415,2024-12-17,livechat,I have done all of that all it says is it it's been processed it's been like that for about a week,undefined
2354,14433,2024-12-17,livechat,Cashing out should be as seamless as depositing,money_issue
2355,14175,2024-12-17,livechat,I need to edit my last name,game_issue
2356,9748,2024-12-17,livechat,"I believe I did meet all the requirements and I'm looking at my profile now, but I don't know if I'm looking at it right",undefined
2357,14613,2024-12-17,livechat,"As for my address confirmation, I can't find any mail with 12 Hinemoa st. But my police fines were sent to my old address??",money_issue account_issue
2358,14091,2024-12-17,livechat,I fell asleep.  And woke up and they were gone,undefined
2359,15572,2024-12-17,livechat,"Obviously, I know that usually I do but I couldn’t today I wanted to play and I was only able to get 20 or 30 every hour or two for the amount of money I spend I was hoping you guys would just pull that together. I don’t think that’s asking too much.",money_issue game_issue account_issue
2360,14477,2024-12-17,livechat,Hello and thank you,undefined
2361,15363,2024-12-17,livechat,dont know the exact number,undefined
2362,15009,2024-12-17,livechat,I know you are good you can't understand you have had experience to see how it goes,undefined
2363,14431,2024-12-17,livechat,Here it is possible to have a response by email about the problem that happened please because I know a customer,account_issue
2364,185,2024-12-17,telegram,How come I didn't get my bonus mania spins,spin_issue money_issue
2365,14973,2024-12-17,livechat,"Listen, I'm tired, I have to go to work there, I'm not going to repeat the same thing to you 15 times, I'm going to send you a detailed email and then you give it to your director or the management or I don't know but I would like an answer on that. please",account_issue
2366,14121,2024-12-17,livechat,I did use real money but barely moved,money_issue
2367,15579,2024-12-17,livechat,Mother fuckers,undefined
2368,14313,2024-12-17,livechat,I don’t want this to interfere with any upcoming bonus timelines,money_issue
2369,14478,2024-12-17,livechat,A want to widraw 90e,undefined
2370,1248,2024-12-17,livechat,I did talk w a professional tax person and they told me that u guys would need to provide my w2,undefined
2371,14773,2024-12-17,livechat,I want to do a withdrawal,undefined
2372,14405,2024-12-17,livechat,Hi my deposit hasn't arrived,money_issue
2373,14668,2024-12-17,livechat,so it given me a bonus x1 not x10.... x10 should be like $7880,money_issue
2374,14974,2024-12-17,livechat,Can you check if I have any unfinished rounds,undefined
2375,1765,2024-12-17,livechat,I ask this red,undefined
2376,11136,2024-12-17,livechat,Yes I understand that but a little understanding from your end would go a long way here,undefined
2377,15631,2024-12-17,livechat,that my password is I’m wrong,undefined
2378,14843,2024-12-17,livechat,i need my money back,money_issue
2379,14226,2024-12-17,livechat,Yes for $1000,undefined
2380,15453,2024-12-17,livechat,is the wrong one,money_issue
2381,1926,2024-12-17,livechat,Ty Or you can read the previous chat and follow up if you would please,undefined
2382,12200,2024-12-17,livechat,I have lots pending but there is one for 71 I accidentally entered 75 in my bank so it was rejected I still had the code so I sent again with the correct amount,money_issue account_issue
2383,14212,2024-12-17,livechat,I uploaded the bill,undefined
2384,14512,2024-12-17,livechat,I have a problem with verification of my bank card,undefined
2385,14216,2024-12-17,livechat,Not t true,undefined
2386,14878,2024-12-17,livechat,"I have all the proof. Screenshots, the whole transcript. The tx hash.",undefined
2387,14228,2024-12-17,livechat,ok Thanks🌹🙏🏻,undefined
2388,13657,2024-12-17,livechat,Not the one I'm talking about,money_issue
2389,279,2024-12-17,telegram,This is John small ****@gmail.com I'm logged in on my friend's phone and I wanted to ask about my play on 12/15/24 11:50pm through 12/16/24 1:21am on buffalo hold and win express.it gave me a bonus and before or after it activated it blanked out.,money_issue game_issue account_issue
2390,15238,2024-12-17,livechat,I just don’t want to play anymore. Thanks,game_issue
2391,14497,2024-12-17,livechat,Something isn't right that's not the email for my new cash out,money_issue account_issue
2392,15247,2024-12-17,livechat,My last deposit wasn't put on it was from a while back,money_issue
2393,14477,2024-12-17,livechat,It's still doing the same thing,undefined
2394,14896,2024-12-17,livechat,No that's not none of those apply I don't have any active bonus or anything and it's still not letting me,money_issue
2395,15484,2024-12-17,livechat,Hey my transfer still hasn’t posted but confirmed hour 15 min ago,undefined
2396,12116,2024-12-17,livechat,Ltc which is a loss by the policy standards so that is where is glitch/system issues lies fix it,undefined
2397,14385,2024-12-17,livechat,it's not a rough patch,undefined
2398,14842,2024-12-18,livechat,and u guys aren’t gonna give me free spins u guys have taken my winnings twice and now denying me my free spins I will be moving to 7 but,spin_issue
2399,14982,2024-12-18,livechat,I just barely deposited,money_issue
2400,15429,2024-12-18,livechat,Ok great! Thanks!,undefined
2401,15386,2024-12-18,livechat,you guys never touch the issue you just allow it to continue,undefined
2402,15623,2024-12-18,livechat,Fuck you thief,undefined
2403,14949,2024-12-18,livechat,no bonuses i didnt know it locks,money_issue
2404,15492,2024-12-18,livechat,thats very different jane,undefined
2405,1305,2024-12-18,livechat,Further assistance please,undefined
2406,273,2024-12-18,telegram,Game won't load now,game_issue
2407,1018,2024-12-18,livechat,What do I have to wager on that because I'm not seeing a bonus that I need to play through,money_issue game_issue
2408,15396,2024-12-18,livechat,how the hell was I supposed to use them instead?,undefined
2409,2874,2024-12-18,livechat,My 30 spins are not working,spin_issue
2410,2648,2024-12-18,livechat,I appreciate your support. I will do this now.,undefined
2411,14961,2024-12-18,livechat,I deposited and received those this email was sent after deposited,money_issue account_issue
2412,14388,2024-12-18,livechat,Actually a YouTuber posted it,undefined
2413,738,2024-12-18,telegram,I never got my 80 spins,spin_issue
2414,14899,2024-12-18,livechat,Hello good morning,undefined
2415,4452,2024-12-18,livechat,I seen many complaints about winning verification its take 8 days maximum,undefined
2416,15646,2024-12-18,livechat,"No, but I sent it to the address given by the application",undefined
2417,15248,2024-12-18,livechat,i’m really frustrated and upset so i’m gonna go it’s fine i’ve been trying to fix this all night it’s not a currency issue i’m understanding you just fine and i did all that already the game keeps glitching out . just never mind .,game_issue
2418,14513,2024-12-18,livechat,The level up spins,spin_issue
2419,14410,2024-12-18,livechat,what document i need to finish to the verification of my profil,undefined
2420,3845,2024-12-18,livechat,What's the deposit refund policy?,money_issue
2421,14572,2024-12-18,livechat,but it won’t work,undefined
2422,2504,2024-12-18,livechat,The RTP just doesn't add up,undefined
2423,15826,2024-12-18,livechat,Oh... it's only 10.49,undefined
2424,15540,2024-12-18,livechat,Is he available?,undefined
2425,15004,2024-12-18,livechat,Hi so are you able to read the above message,undefined
2426,15815,2024-12-18,livechat,"Hi, I already loaded a bank statement and it’s again not right",undefined
2427,15096,2024-12-18,livechat,"listen, I know what it shows. That’s my problem.",undefined
2428,1272,2024-12-18,livechat,Can you see the spins round? Where did it say minor  won,spin_issue
2429,15307,2024-12-18,livechat,Oh ok...so i can play the spins first...,spin_issue game_issue
2430,15273,2024-12-18,livechat,I made a new account today and I know for a fact that nobody in my household has one because I live alone with my 3 ywar old daughter.,money_issue account_issue
2431,14938,2024-12-18,livechat,I did it ony cash app,money_issue
2432,15580,2024-12-18,livechat,"Hello, good day, I received an email from you asking me to upload the deposits I made in the game, but I have already uploaded all the deposits made. Please check. Thanks.",money_issue game_issue account_issue
2433,15696,2024-12-18,livechat,is there an maximum amount of times you can withdrawal daily,account_issue
2434,15640,2024-12-18,livechat,"I'll keep looking, problem is I just moved to a new place",undefined
2435,15840,2024-12-18,livechat,I want to talk to a live representative,undefined
2436,1371,2024-12-18,livechat,No thanks. I appreciate your help alot,undefined
2437,14935,2024-12-18,livechat,"I just had this before, because of a bitcoin transaction",money_issue
2438,9146,2024-12-18,livechat,Mate I've been a customer for over 5 years and I have never found it this hard to verify a bank deposit I payid a payment and it doesn't come up under my statements what I provided is more than enough,money_issue
2439,15185,2024-12-18,livechat,I sent n ten bucks last night and it's not n my account I refreshed the address this is crazy stuiped,account_issue
2440,15663,2024-12-18,livechat,Can I play on,game_issue
2441,2580,2024-12-18,livechat,Im trying to play my fs and everytime I click on the game it takes me right back to free spin page and that's it,spin_issue game_issue
2442,15947,2024-12-19,livechat,but then its only for one of the two transactions . maybe the other will come up next ? I have never seen anything like this before,money_issue
2443,15720,2024-12-19,livechat,and see how much I will have left,undefined
2444,2348,2024-12-19,livechat,I was playing Jack I played my free spins on the jackpot mania and I got the 333 a gambled it if I won it was 666 and I didn't receive my the minor,spin_issue game_issue
2445,15543,2024-12-19,livechat,I did not intend to activate it,undefined
2446,949,2024-12-19,telegram,Do you know why my play is still suspended?  I know I withdrew too much. The game me back the $100 I could with draw so I did but my play is still suspended?,game_issue
2447,15710,2024-12-19,livechat,You guys owe me BTC rewards for my deposit,money_issue
2448,7463,2024-12-19,livechat,I sent 13.97 to my account sometime ago and it's still not there?,account_issue
2449,16027,2024-12-19,livechat,I had 15 free spins and they say expired on the 12th of I'm not mistaking I don't have no email saying that I want my 15 free spins,spin_issue account_issue
2450,15406,2024-12-19,livechat,"Thats ok, thank you.",undefined
2451,15472,2024-12-19,livechat,"Hey, is there any chance that you could provide me some free spins?",spin_issue
2452,15202,2024-12-19,livechat,let me try to send it again,undefined
2453,15077,2024-12-19,livechat,"sigh, well can it be forgiven this time since, i didn't know that",undefined
2454,15572,2024-12-19,livechat,Good day I wanted to ask how much of the bonus I still have to turn over because when I look at my profile something can't be right because I got a picture of over 900 euros and the bonus that I have to turn over was something like 500 something so the bonus turnover can't be 500 something anymore because over 900 euros were played and won,money_issue game_issue
2455,15744,2024-12-19,livechat,for example hitting a bonus on a slot then leaving the game to hit another bonus on a different slot and opening them 1 by 1 at the end?,money_issue game_issue
2456,15259,2024-12-19,livechat,Hi it’s my birthday tomorrow and I’m hoping I can please have a free bonus for being a loyal player all year,money_issue spin_issue game_issue
2457,740,2024-12-19,livechat,gien my years of experience,undefined
2458,15459,2024-12-19,livechat,With bitcoin and LTC,money_issue
2459,15591,2024-12-19,livechat,"if thats the rules its fine, it does not specify only one type of crypto",money_issue
2460,15339,2024-12-19,livechat,I I ly have this from a month ago,undefined
2461,14912,2024-12-19,livechat,awww!! Thank you so much!!!,undefined
2462,14658,2024-12-19,livechat,But there didnt stand accept,undefined
2463,14900,2024-12-19,livechat,and i normally i get a e-mail that the withdrawal is accepted,account_issue
2464,15532,2024-12-19,livechat,"Hello, the messages I write in the chat section of the Evolution game immersive roulette table are not visible to any user, what is the reason?",game_issue
2465,14900,2024-12-19,livechat,sorun devam ediyor,undefined
